
Key,Url,Title,Item Type,Publication Year,Author,Reviewer1,Reviewer2,Reviewer3,Reviewer4,Reviewer5,Overall,Agreement,Comment,Publication Title,ISBN,ISSN,DOI,Abstract Note,Date,Date Added,Date Modified,Access Date,Pages,Num Pages,Issue,Volume,Number Of Volumes,Journal Abbreviation,Short Title,Series,Series Number,Series Text,Series Title,Publisher,Place,Language,Rights,Type,Archive,Archive Location,Library Catalog,Call Number,Extra,Notes,File Attachments,Link Attachments,Manual Tags,Automatic Tags,Editor,Series Editor,Translator,Contributor,Attorney Agent,Book Author,Cast Member,Commenter,Composer,Cosponsor,Counsel,Interviewer,Producer,Recipient,Reviewed Author,Scriptwriter,Words By,Guest,Number,Edition,Running Time,Scale,Medium,Artwork Size,Filing Date,Application Number,Assignee,Issuing Authority,Country,Meeting Name,Conference Name,Court,References,Reporter,Legal Status,Priority Numbers,Programming Language,Version,System,Code,Code Number,Section,Session,Committee,History,Legislative Body
SBLYAWT8,https://www.scopus.com/inward/record.uri?eid=2-s2.0-85101967110&doi=10.1007%2fs11192-021-03898-y&partnerID=40&md5=b587bef4ddd461dc952835185757c5fa,Characteristics of high research performance authors in the field of library and information science and those of their articles,journalArticle,2021,"Chang, Yu-Wei",,,-1,-1,,-1,1,,Scientometrics,,1389130,10.1007/s11192-021-03898-y,,2021,2024-06-07 14:43:56,2024-06-07 14:43:56,,3373 – 3391,,4,126,,,,,,,,,,,,,,,,,Publisher: Springer Science and Business Media B.V.,,,,,,,,,,,,,,,,,,,,,,,,,,,,,,,,,,,,,,,,,,,,,,,,,,,
468582QN,https://www.scopus.com/inward/record.uri?eid=2-s2.0-85116044736&doi=10.1080%2f08989621.2021.1982705&partnerID=40&md5=2c282f92f7e823db2fbe15b6aa93bc38,Authorship commerce: Bylines for sale,journalArticle,2023,"Chirico, Francesco; Bramstedt, Katrina Andrea",-1,-1,,,,-1,1,NO ACCESS TO THE FULL ARTICLE,Accountability in Research,,8989621,10.1080/08989621.2021.1982705,,2023,2024-06-07 14:43:56,2024-06-07 14:43:56,,246 – 251,,4,30,,,,,,,,,,,,,,,,,Publisher: Taylor and Francis Ltd.,,,,,,,,,,,,,,,,,,,,,,,,,,,,,,,,,,,,,,,,,,,,,,,,,,,
AZRNMXVU,https://www.scopus.com/inward/record.uri?eid=2-s2.0-85099220565&doi=10.1038%2fs41598-020-79447-z&partnerID=40&md5=aa966e22c9f39d70678860c99d005913,Interplay between success and patterns of human collaboration: case study of a Thai Research Institute,journalArticle,2021,"Fiscarelli, Antonio Maria; Brust, Matthias R.; Bouffanais, Roland; Piyatumrong, Apivadee; Danoy, Grégoire; Bouvry, Pascal",-1,,-1,,,-1,1,,Scientific Reports,,20452322,10.1038/s41598-020-79447-z,,2021,2024-06-07 14:43:57,2024-06-07 14:43:57,,,,1,11,,,,,,,,,,,,,,,,,Publisher: Nature Research,,,,,,,,,,,,,,,,,,,,,,,,,,,,,,,,,,,,,,,,,,,,,,,,,,,
R75U8MXU,https://www.scopus.com/inward/record.uri?eid=2-s2.0-85135538961&doi=10.3138%2fjsp-2021-0021&partnerID=40&md5=336fd093310f1df46cd002d79d1be040,Achieving a Professorship with Proper Academic Merit Discouraging Questionable Publishing,journalArticle,2022,"Frandsen, Tove Faber; Lamptey, Richard Bruce; Borteye, Edward Mensah; Teye, Victor",,,-1,-1,,-1,1,Free access at https://findresearcher.sdu.dk/ws/portalfiles/portal/208974967/Promotion_preprint.pdf Shared by authors,Journal of Scholarly Publishing,,11989742,10.3138/jsp-2021-0021,,2022,2024-06-07 14:43:57,2024-06-07 14:43:57,,155 – 167,,3,53,,,,,,,,,,,,,,,,,Publisher: University of Toronto Press,,,,,,,,,,,,,,,,,,,,,,,,,,,,,,,,,,,,,,,,,,,,,,,,,,,
WB39L8T4,https://www.scopus.com/inward/record.uri?eid=2-s2.0-85049621139&doi=10.1215%2f18752160-4275144&partnerID=40&md5=5a6f0c1b6b8eb7982666b9d9a0384843,How metrics-based academic evaluation could systematically induce academic misconduct: A case study,journalArticle,2018,"Han, Junhui; Li, Zhengfeng",-1,,,,-1,-1,0,NO ACCESS TO THE FULL ARTICLE,"East Asian Science, Technology and Society",,18752160,10.1215/18752160-4275144,,2018,2024-06-07 14:43:59,2024-06-07 14:43:59,,165 – 179,,2,12,,,,,,,,,,,,,,,,,Publisher: Duke University Press,,,,,,,,,,,,,,,,,,,,,,,,,,,,,,,,,,,,,,,,,,,,,,,,,,,
X2EX2WBT,https://www.scopus.com/inward/record.uri?eid=2-s2.0-85174950962&doi=10.1007%2fs11192-023-04852-w&partnerID=40&md5=7d31f7d9c15a06aa9dc301b1aaf5c3e4,Some thoughts on transparency of the data and analysis behind the Highly Cited Researchers list,journalArticle,2023,"Klein, Alexandra-Maria; Kranke, Nina",-1,-1,,,,-1,1,,Scientometrics,,1389130,10.1007/s11192-023-04852-w,,2023,2024-06-07 14:44:01,2024-06-07 14:44:01,,6773 – 6780,,12,128,,,,,,,,,,,,,,,,,Publisher: Akademiai Kiado ZRt.,,,,,,,,,,,,,,,,,,,,,,,,,,,,,,,,,,,,,,,,,,,,,,,,,,,
B453PJ3U,https://www.scopus.com/inward/record.uri?eid=2-s2.0-85075588136&doi=10.1007%2fs11192-019-03092-1&partnerID=40&md5=989db1d425665145c62ec10380f1be84,Examining how country-level science policy shapes publication patterns: The case of Poland,journalArticle,2019,"Korytkowski, Przemysław; Kulczycki, Emanuel",,-1,-1,,,-1,1,,Scientometrics,,1389130,10.1007/s11192-019-03092-1,,2019,2024-06-07 14:44:01,2024-06-07 14:44:01,,1519 – 1543,,3,119,,,,,,,,,,,,,,,,,Publisher: Springer Science and Business Media B.V.,,,,,,,,,,,,,,,,,,,,,,,,,,,,,,,,,,,,,,,,,,,,,,,,,,,
6J5HEPD3,https://www.scopus.com/inward/record.uri?eid=2-s2.0-84991672288&doi=10.1371%2fjournal.pone.0162709&partnerID=40&md5=8c2572baa2fb18c0a0dd357079b50a6a,How many is too many? On the relationship between research productivity and impact,journalArticle,2016,"Larivière, Vincent; Costas, Rodrigo",-1,,-1,,,-1,1,,PLoS ONE,,19326203,10.1371/journal.pone.0162709,,2016,2024-06-07 14:44:02,2024-06-07 14:44:02,,,,9,11,,,,,,,,,,,,,,,,,Publisher: Public Library of Science,,,,,,,,,,,,,,,,,,,,,,,,,,,,,,,,,,,,,,,,,,,,,,,,,,,
I2TI9JVD,https://www.scopus.com/inward/record.uri?eid=2-s2.0-85185485810&doi=10.1002%2fasi.24876&partnerID=40&md5=3323b352ac77da6a47f4f2ace58bce16,Understanding super-partnerships in scientific collaboration: Evidence from the field of economics,journalArticle,2024,"Liu, Junwan; Guo, Xiaofei; Xu, Shuo; Bu, Yi; Sugimoto, Cassidy R.; Larivière, Vincent; Song, Yinglu; Zhou, Honghao",,,-1,-1,,-1,1,,Journal of the Association for Information Science and Technology,,23301635,10.1002/asi.24876,,2024,2024-06-07 14:44:03,2024-06-07 14:44:03,,,,,,,,,,,,,,,,,,,,,,Publisher: John Wiley and Sons Inc,,,,,,,,,,,,,,,,,,,,,,,,,,,,,,,,,,,,,,,,,,,,,,,,,,,
XPRT9HV2,https://www.scopus.com/inward/record.uri?eid=2-s2.0-84961204477&doi=10.1007%2fs11948-016-9766-1&partnerID=40&md5=e23c0d5160118ad696c0ffeaade904d8,Chinese and Iranian Scientific Publications: Fast Growth and Poor Ethics,journalArticle,2017,"Ataie-Ashtiani, Behzad",,-1,,,-1,-1,1,letter,Science and Engineering Ethics,,13533452,10.1007/s11948-016-9766-1,,2017,2024-06-07 14:43:53,2024-06-07 14:43:53,,317 – 319,,1,23,,,,,,,,,,,,,,,,,Publisher: Springer Netherlands,,,,,,,,,,,,,,,,,,,,,,,,,,,,,,,,,,,,,,,,,,,,,,,,,,,
C3VWDZHZ,https://www.scopus.com/inward/record.uri?eid=2-s2.0-84962877989&doi=10.12669%2fpjms.322.10326&partnerID=40&md5=e4aac49222bbc99fa9da92b0146d6f80,Publish or Perish: Need to have another look?,journalArticle,2016,"Jawaid, Shaukat Ali",,,,-1,-1,-1,1,editorial,Pakistan Journal of Medical Sciences,,1682024X,10.12669/pjms.322.10326,,2016,2024-06-07 14:44:00,2024-06-07 14:44:00,,267 – 269,,2,32,,,,,,,,,,,,,,,,,Publisher: Professional Medical Publications,,,,,,,,,,,,,,,,,,,,,,,,,,,,,,,,,,,,,,,,,,,,,,,,,,,
,https://www.scopus.com/inward/record.uri?eid=2-s2.0-84940729147&doi=10.1016%2fj.joi.2015.08.002&partnerID=40&md5=818ad7c3d02fca11a3227bcc1281d1d0,How to become an important player in scientific collaboration networks?,,2015,Ebadi A.; Schiffauerova A.,-1,-1,,,-1,-1,1,,,,,,,,,,,,,,,,,,,,,,,,,,,,,,,,,,,,,,,,,,,,,,,,,,,,,,,,,,,,,,,,,,,,,,,,,,,,,,,,,,
,https://www.scopus.com/inward/record.uri?eid=2-s2.0-84949814483&doi=10.1108%2fAJIM-12-2014-0172&partnerID=40&md5=80293661960eea6bbd104291cd1fc03f,Efficacy of a giant component in co-authorship networks: Evidence from a Southeast Asian dataset in economics,,2016,Kumar S.,,-1,-1,,-1,-1,1,,,,,,,,,,,,,,,,,,,,,,,,,,,,,,,,,,,,,,,,,,,,,,,,,,,,,,,,,,,,,,,,,,,,,,,,,,,,,,,,,,
,https://www.scopus.com/inward/record.uri?eid=2-s2.0-21344494899&doi=10.1007%2fBF01384088&partnerID=40&md5=bedfbf3ebb39b13853fccdef3b543c1b,The determinants of research performance: A study of Australian university economists,,1994,Harris G.; Kaine G.,,-1,,-1,-1,-1,1,,,,,,,,,,,,,,,,,,,,,,,,,,,,,,,,,,,,,,,,,,,,,,,,,,,,,,,,,,,,,,,,,,,,,,,,,,,,,,,,,,
,https://www.scopus.com/inward/record.uri?eid=2-s2.0-85094215912&doi=10.1007%2fs11192-020-03746-5&partnerID=40&md5=f6087e1c7d9224690958466f8c07c308,The coauthorship networks of the most productive European researchers,,2021,Hâncean M.-G.; Perc M.; Lerner J.,-1,-1,,-1,,-1,1,,,,,,,,,,,,,,,,,,,,,,,,,,,,,,,,,,,,,,,,,,,,,,,,,,,,,,,,,,,,,,,,,,,,,,,,,,,,,,,,,,
,https://www.scopus.com/inward/record.uri?eid=2-s2.0-84995969113&doi=10.1371%2fjournal.pone.0166149&partnerID=40&md5=8b3f0c8488c5d2c16c6d7c95ea2a7276,Quantity and/or quality? The importance of publishing many papers,,2016,Sandström U.; Van Besselaar P.D.,-1,-1,,,-1,-1,1,,,,,,,,,,,,,,,,,,,,,,,,,,,,,,,,,,,,,,,,,,,,,,,,,,,,,,,,,,,,,,,,,,,,,,,,,,,,,,,,,,
,https://www.scopus.com/inward/record.uri?eid=2-s2.0-0040662040&doi=10.1007%2fBF02016774&partnerID=40&md5=7992a8cbd7f4608f1a19b9f5511eedb2,Dual approach to multiple authorship in the study of collaboration/scientific output relationship,,1986,Pravdić N.; Oluić-Vuković V.,-1,,,-1,-1,-1,1,,,,,,,,,,,,,,,,,,,,,,,,,,,,,,,,,,,,,,,,,,,,,,,,,,,,,,,,,,,,,,,,,,,,,,,,,,,,,,,,,,
,https://www.scopus.com/inward/record.uri?eid=2-s2.0-85086662680&doi=10.1016%2fj.aej.2020.05.016&partnerID=40&md5=8967523c7f9c0a59f6a752186ce22f99,A bibliometric analysis of Atangana-Baleanu operators in fractional calculus,,2020,Templeton A.,0,-1,-1,,,-1,1,,,,,,,,,,,,,,,,,,,,,,,,,,,,,,,,,,,,,,,,,,,,,,,,,,,,,,,,,,,,,,,,,,,,,,,,,,,,,,,,,,
,https://www.scopus.com/inward/record.uri?eid=2-s2.0-85041057644&doi=10.1007%2fs12652-017-0521-5&partnerID=40&md5=911c07e75ce4114f98a7d63b4e89dcbe,An extended study of collaboration networks of Levantine biomedical researchers,,2018,Al-Ayyoub M.; Arkok B.; Jararweh Y.,-1,-1,,-1,,-1,1,,,,,,,,,,,,,,,,,,,,,,,,,,,,,,,,,,,,,,,,,,,,,,,,,,,,,,,,,,,,,,,,,,,,,,,,,,,,,,,,,,
,https://www.scopus.com/inward/record.uri?eid=2-s2.0-84991098081&partnerID=40&md5=3e71241654a2fa4981b4fefa28ce2ef4,Does quantity make a difference?,,2015,Van Den Besselaar P.; Sandstrom U.,,-1,-1,-1,,-1,1,,,,,,,,,,,,,,,,,,,,,,,,,,,,,,,,,,,,,,,,,,,,,,,,,,,,,,,,,,,,,,,,,,,,,,,,,,,,,,,,,,
,https://www.scopus.com/inward/record.uri?eid=2-s2.0-84987678178&doi=10.1002%2fasi.23580&partnerID=40&md5=2e9156f40ccdc21e3978b785ee24e316,"Author practices in citing other authors, institutions, and journals",,2016,Gazni A.; Ghaseminik Z.,-1,,-1,-1,,-1,1,,,,,,,,,,,,,,,,,,,,,,,,,,,,,,,,,,,,,,,,,,,,,,,,,,,,,,,,,,,,,,,,,,,,,,,,,,,,,,,,,,
,https://www.scopus.com/inward/record.uri?eid=2-s2.0-85121710103&doi=10.1080%2f10508422.2021.2015598&partnerID=40&md5=3f37cead6f527df5a8b0a98508ccfcd7,Evolution of research on honesty and dishonesty in academic work: a bibliometric analysis of two decades,,2023,Mahmud S.; Ali I.,-1,-1,,0,-1,-1,2,,,,,,,,,,,,,,,,,,,,,,,,,,,,,,,,,,,,,,,,,,,,,,,,,,,,,,,,,,,,,,,,,,,,,,,,,,,,,,,,,,
,https://www.scopus.com/inward/record.uri?eid=2-s2.0-85131419871&doi=10.1108%2fGKMC-01-2022-0012&partnerID=40&md5=641b358b42d23287123b641802ede7c3,Assessing the research profile of highly productive authors of Pakistan,,2024,Wahid N.; Warraich N.F.; Tahira M.,-1,,-1,,-1,-1,1,,,,,,,,,,,,,,,,,,,,,,,,,,,,,,,,,,,,,,,,,,,,,,,,,,,,,,,,,,,,,,,,,,,,,,,,,,,,,,,,,,
,https://www.scopus.com/inward/record.uri?eid=2-s2.0-78650966613&doi=10.1177%2f1046878110387539&partnerID=40&md5=5dc6c65ff19424701a078c88ecefee53,Profiling 40 years of research in simulation & gaming,,2010,Bragge J.; Thavikulwat P.; Töyli J.,-1,,-1,,-1,-1,1,,,,,,,,,,,,,,,,,,,,,,,,,,,,,,,,,,,,,,,,,,,,,,,,,,,,,,,,,,,,,,,,,,,,,,,,,,,,,,,,,,
,,"A Collapsing Academy, Part III: Scientometrics and Metric Mani",,,,-1,,-1,,-1,-1,1,,,,,,,,,,,,,,,,,,,,,,,,,,,,,,,,,,,,,,,,,,,,,,,,,,,,,,,,,,,,,,,,,,,,,,,,,,,,,,,,,,
,,Watch out for cheats in citation gam,,,,-1,,,-1,-1,-1,1,,,,,,,,,,,,,,,,,,,,,,,,,,,,,,,,,,,,,,,,,,,,,,,,,,,,,,,,,,,,,,,,,,,,,,,,,,,,,,,,,,
,,"Quantifying the impact of weak, strong, and super ties in scientific careers",,,,-1,,-1,-1,,-1,1,,,,,,,,,,,,,,,,,,,,,,,,,,,,,,,,,,,,,,,,,,,,,,,,,,,,,,,,,,,,,,,,,,,,,,,,,,,,,,,,,,
,,Cash incentives for papers go global,,,,,-1,-1,-1,,-1,1,,,,,,,,,,,,,,,,,,,,,,,,,,,,,,,,,,,,,,,,,,,,,,,,,,,,,,,,,,,,,,,,,,,,,,,,,,,,,,,,,,
,,Gaming the metrics: Misconduct and manipulation in academic research,,,,,,1,-1,-1,-1,2,,,,,,,,,,,,,,,,,,,,,,,,,,,,,,,,,,,,,,,,,,,,,,,,,,,,,,,,,,,,,,,,,,,,,,,,,,,,,,,,,,
,,Prolificacy and visibility versus reputation in the hard sciences,,,,-1,,,-1,,-1,1,,,,,,,,,,,,,,,,,,,,,,,,,,,,,,,,,,,,,,,,,,,,,,,,,,,,,,,,,,,,,,,,,,,,,,,,,,,,,,,,,,
,,Skewed distributions of scientists’ productivity: a research program for the empirical analysis,,,,-1,,,-1,,-1,1,,,,,,,,,,,,,,,,,,,,,,,,,,,,,,,,,,,,,,,,,,,,,,,,,,,,,,,,,,,,,,,,,,,,,,,,,,,,,,,,,,
,,"Letter to the Editor: publish, publish … cursed!",,,,-1,,,-1,,-1,1,,,,,,,,,,,,,,,,,,,,,,,,,,,,,,,,,,,,,,,,,,,,,,,,,,,,,,,,,,,,,,,,,,,,,,,,,,,,,,,,,,
,,Not the Last Word: The Academic Inflation Reduction Act,,,,-1,,,-1,,-1,1,,,,,,,,,,,,,,,,,,,,,,,,,,,,,,,,,,,,,,,,,,,,,,,,,,,,,,,,,,,,,,,,,,,,,,,,,,,,,,,,,,
,,The metrics maze in science: navigating academic evaluation without journalistic pressures,,,,-1,,,-1,,-1,1,,,,,,,,,,,,,,,,,,,,,,,,,,,,,,,,,,,,,,,,,,,,,,,,,,,,,,,,,,,,,,,,,,,,,,,,,,,,,,,,,,
UVJ6NHV7,https://www.scopus.com/inward/record.uri?eid=2-s2.0-85120980957&doi=10.5935%2f0004-2749.20210122&partnerID=40&md5=43ccb1539bcc4c262295bd28fa7315c0,Prolific Authors In Ophthalmology And Vision Science; [Autores Prolíficos Em Oftalmologia E Ciência Da Visão],journalArticle,2021,"Lansingh, Van C.; Eckert, Kristen A.; Quiroga, Armando E. Elizondo",,0,,0,,0,1,,Arquivos Brasileiros de Oftalmologia,,42749,10.5935/0004-2749.20210122,,2021,2024-06-07 14:44:02,2024-06-07 14:44:02,,624 – 627,,6,84,,,,,,,,,,,,,,,,,Publisher: Conselho Brasileiro De Oftalmologia,,,,,,,,,,,,,,,,,,,,,,,,,,,,,,,,,,,,,,,,,,,,,,,,,,,
,https://www.scopus.com/inward/record.uri?eid=2-s2.0-85118221017&doi=10.1098%2frsos.210389&partnerID=40&md5=4152eaac0b6a63839203eb75b1ddf616,"The rapid, massive growth of COVID-19 authors in the scientific literature",,2021,Ioannidis J.P.A.; Salholz-Hillel M.; Boyack K.W.; Baas J.,,,-1,0,0,0,2,,,,,,,,,,,,,,,,,,,,,,,,,,,,,,,,,,,,,,,,,,,,,,,,,,,,,,,,,,,,,,,,,,,,,,,,,,,,,,,,,,
,https://www.scopus.com/inward/record.uri?eid=2-s2.0-77957858394&doi=10.1016%2fj.adiac.2010.05.001&partnerID=40&md5=6710b4badfa73e94e83b0dd04456fd5c,Giving credit where credit is due: Summary analysis of the most prolific authors in 15 high-impact accounting journals,,2010,Danielson M.G.; Heck J.L.,,0,,0,0,0,2,,,,,,,,,,,,,,,,,,,,,,,,,,,,,,,,,,,,,,,,,,,,,,,,,,,,,,,,,,,,,,,,,,,,,,,,,,,,,,,,,,
,https://www.scopus.com/inward/record.uri?eid=2-s2.0-85164843564&doi=10.1097%2fMD.0000000000034301&partnerID=40&md5=5f904e70266eebaf23b9fe4fb831475b,Visual impact beam plots: Analyzing research profiles and bibliometric metrics using the following-leading clustering algorithm (FLCA),,2023,Cheng Y.-Z.; Chien T.-W.; Ho S.Y.-C.; Chou W.,0,,0,0,,0,1,,,,,,,,,,,,,,,,,,,,,,,,,,,,,,,,,,,,,,,,,,,,,,,,,,,,,,,,,,,,,,,,,,,,,,,,,,,,,,,,,,
,https://www.scopus.com/inward/record.uri?eid=2-s2.0-85012108894&doi=10.5406%2famerjpsyc.130.1.0105&partnerID=40&md5=4a1367d6a9645f2f4c9ba38de2012067,Publish and Perish: Psychology's most prolific authors are not always the ones we remember,,2017,Green C.D.,,0,0,,0,0,1,,,,,,,,,,,,,,,,,,,,,,,,,,,,,,,,,,,,,,,,,,,,,,,,,,,,,,,,,,,,,,,,,,,,,,,,,,,,,,,,,,
X333ZZGV,https://www.scopus.com/inward/record.uri?eid=2-s2.0-84961233938&doi=10.1371%2fjournal.pone.0149504&partnerID=40&md5=894d908240844e3a1c533929418197f6,Researchers' individual publication rate has not increased in a century,journalArticle,2016,"Fanelli, Daniele; Larivière, Vincent",,1,,1,,1,1,,PLoS ONE,,19326203,10.1371/journal.pone.0149504,,2016,2024-06-07 14:43:57,2024-06-07 14:43:57,,,,3,11,,,,,,,,,,,,,,,,,Publisher: Public Library of Science,,,,,,,,,,,,,,,,,,,,,,,,,,,,,,,,,,,,,,,,,,,,,,,,,,,
9ZPT9RXM,https://www.scopus.com/inward/record.uri?eid=2-s2.0-85089745691&doi=10.1007%2fs10734-020-00609-z&partnerID=40&md5=efce45aa1b9184d87f17490dc8887e9c,Being highly prolific in academic science: characteristics of individuals and their departments,journalArticle,2021,"Fox, Mary Frank; Nikivincze, Irina",1,,,1,,1,1,,Higher Education,,181560,10.1007/s10734-020-00609-z,,2021,2024-06-07 14:43:57,2024-06-07 14:43:57,,1237 – 1255,,6,81,,,,,,,,,,,,,,,,,Publisher: Springer Science and Business Media B.V.,,,,,,,,,,,,,,,,,,,,,,,,,,,,,,,,,,,,,,,,,,,,,,,,,,,
HYLYYJVS,https://www.scopus.com/inward/record.uri?eid=2-s2.0-85096035529&partnerID=40&md5=54b6b702c382ece3d3470f946c1d2db0,Highly prolific authors in medical science: From charisma to opportunism,journalArticle,2020,"Moris, Dimitrios",1,1,,,,1,1,,Journal of B.U.ON.,,11070625,,,2020,2024-06-07 14:44:04,2024-06-07 14:44:04,,2136 – 2140,,5,25,,,,,,,,,,,,,,,,,Publisher: Zerbinis Publications,,,,,,,,,,,,,,,,,,,,,,,,,,,,,,,,,,,,,,,,,,,,,,,,,,,
FNGPWC4R,https://www.scopus.com/inward/record.uri?eid=2-s2.0-85186256339&doi=10.1007%2fs11192-024-04940-5&partnerID=40&md5=f4bed3413513940cf5451d2ad7f04397,A network-driven study of hyperprolific authors in computer science,journalArticle,2024,"Vieira, Vinícius da F.; Ferreira, Carlos H. G.; Almeida, Jussara M.; Moreira, Edré; Laender, Alberto H. F.; Meira, Wagner; Gonçalves, Marcos André",1,,1,,,1,1,,Scientometrics,,1389130,10.1007/s11192-024-04940-5,,2024,2024-06-07 14:44:09,2024-06-07 14:44:09,,,,,,,,,,,,,,,,,,,,,,Publisher: Akademiai Kiado ZRt.,,,,,,,,,,,,,,,,,,,,,,,,,,,,,,,,,,,,,,,,,,,,,,,,,,,
JR8BHAWS,https://www.scopus.com/inward/record.uri?eid=2-s2.0-85120475572&doi=10.1111%2focr.12551&partnerID=40&md5=8fa563a3b3b841e975ae22790e6dbfdc,Prolific authorship in orthodontic scientific publishing,journalArticle,2022,"Wong, Constance; Papageorgiou, Spyridon N.; Seehra, Jadbinder; Cobourne, Martyn T.",,1,,1,2,1,1,,Orthodontics and Craniofacial Research,,16016335,10.1111/ocr.12551,,2022,2024-06-07 14:44:10,2024-06-07 14:44:10,,416 – 428,,3,25,,,,,,,,,,,,,,,,,Publisher: John Wiley and Sons Inc,,,,,,,,,,,,,,,,,,,,,,,,,,,,,,,,,,,,,,,,,,,,,,,,,,,
,https://www.scopus.com/inward/record.uri?eid=2-s2.0-85076669254&doi=10.1136%2febmental-2019-300122&partnerID=40&md5=860e6bac7441d1240658117472f05e24,Measuring an individual researcher's impact: New directions and challenges,,,,,1,,1,,1,1,,,,,,,,,,,,,,,,,,,,,,,,,,,,,,,,,,,,,,,,,,,,,,,,,,,,,,,,,,,,,,,,,,,,,,,,,,,,,,,,,,
,https://www.scopus.com/inward/record.uri?eid=2-s2.0-85149853472&doi=10.1007%2fs11192-023-04676-8&partnerID=40&md5=4972a6ec89e12297c7b0cc7279b8abf2,The rise of hyperprolific authors in computer science: characterization and implications,,2023,"Moreira E.; Meira W., Jr.; Gonçalves M.A.; Laender A.H.F.",1,,,1,1,1,1,,,,,,,,,,,,,,,,,,,,,,,,,,,,,,,,,,,,,,,,,,,,,,,,,,,,,,,,,,,,,,,,,,,,,,,,,,,,,,,,,,
,https://www.scopus.com/inward/record.uri?eid=2-s2.0-85058452458&doi=10.1007%2fs11192-018-2982-5&partnerID=40&md5=4f039235492a47e45a0ec069f9a0c00f,Productivity does not equal usefulness,,2019,Bornmann L.; Tekles A.,1,1,1,-1,,1,2,,,,,,,,,,,,,,,,,,,,,,,,,,,,,,,,,,,,,,,,,,,,,,,,,,,,,,,,,,,,,,,,,,,,,,,,,,,,,,,,,,
,https://www.scopus.com/inward/record.uri?eid=2-s2.0-85122170281&doi=10.1371%2fjournal.pbio.3001133&partnerID=40&md5=c982a5e4c18e5903216132b4094bf51c,A survey of biomedical journals to detect editorial bias and nepotistic behavior,,2021,Scanff A.; Naudet F.; Cristea I.A.; Moher D.; Bishop D.V.M.; Locher C.,,,1,1,1,1,1,,,,,,,,,,,,,,,,,,,,,,,,,,,,,,,,,,,,,,,,,,,,,,,,,,,,,,,,,,,,,,,,,,,,,,,,,,,,,,,,,,
,https://www.scopus.com/inward/record.uri?eid=2-s2.0-85121031597&doi=10.31577%2fEKONCAS.2021.08.05&partnerID=40&md5=65e2b8858efeaa275272e61d2da1694f,Global research talents: Analysis of their behavior and publication/citation patterns,,2021,Brzica D.,-1,1,1,,,1,1,,,,,,,,,,,,,,,,,,,,,,,,,,,,,,,,,,,,,,,,,,,,,,,,,,,,,,,,,,,,,,,,,,,,,,,,,,,,,,,,,,
,,Over-optimization of academic publishing metrics: observing Good- hart’s Law in action,,,,,1,1,,1,1,1,,,,,,,,,,,,,,,,,,,,,,,,,,,,,,,,,,,,,,,,,,,,,,,,,,,,,,,,,,,,,,,,,,,,,,,,,,,,,,,,,,
,,Thousands of scientists publish a paper every five days,,,,1,,,1,1,1,1,,,,,,,,,,,,,,,,,,,,,,,,,,,,,,,,,,,,,,,,,,,,,,,,,,,,,,,,,,,,,,,,,,,,,,,,,,,,,,,,,,
,,Too much of a good thing? An observational study of prolific authors,,,,1,1,1,,,1,1,,,,,,,,,,,,,,,,,,,,,,,,,,,,,,,,,,,,,,,,,,,,,,,,,,,,,,,,,,,,,,,,,,,,,,,,,,,,,,,,,,
,,Inflated numbers of authors over time have not been just due to increasing research complexity,,,,2,2,1,2,,2,2,,,,,,,,,,,,,,,,,,,,,,,,,,,,,,,,,,,,,,,,,,,,,,,,,,,,,,,,,,,,,,,,,,,,,,,,,,,,,,,,,,
,,"Business science: Overproduction, self-citations and Article processing charge (APC) | Ciencias empresariales: Sobreproducción, autocitas y tasa por tratamiento de artículos (APC)",,,,1,,,1,,1,1,,,,,,,,,,,,,,,,,,,,,,,,,,,,,,,,,,,,,,,,,,,,,,,,,,,,,,,,,,,,,,,,,,,,,,,,,,,,,,,,,,
,,Evolving patterns of extreme publishing behavior across science,,,,1,,,1,,1,1,,,,,,,,,,,,,,,,,,,,,,,,,,,,,,,,,,,,,,,,,,,,,,,,,,,,,,,,,,,,,,,,,,,,,,,,,,,,,,,,,,
,,Identifying and analyzing extremely productive authors in intensive care medicine: A scientometric analysis,,,,1,,,1,,1,1,,,,,,,,,,,,,,,,,,,,,,,,,,,,,,,,,,,,,,,,,,,,,,,,,,,,,,,,,,,,,,,,,,,,,,,,,,,,,,,,,,
,,Why does cardiology have many extreme publishing authors?,,,,1,,,1,,1,1,,,,,,,,,,,,,,,,,,,,,,,,,,,,,,,,,,,,,,,,,,,,,,,,,,,,,,,,,,,,,,,,,,,,,,,,,,,,,,,,,,
7E4TQZ86,https://www.scopus.com/inward/record.uri?eid=2-s2.0-85140818507&doi=10.1371%2fjournal.pone.0270618&partnerID=40&md5=af81cb748e267ff906523262885ac9e5,Publication games: In the web of reciprocity,journalArticle,2022,"Barta, Zoltán",2,,,,2,2,0,,PLoS ONE,,19326203,10.1371/journal.pone.0270618,,2022,2024-06-07 14:43:54,2024-06-07 14:43:54,,,,10 October,17,,,,,,,,,,,,,,,,,Publisher: Public Library of Science,,,,,,,,,,,,,,,,,,,,,,,,,,,,,,,,,,,,,,,,,,,,,,,,,,,
UTXNWSPQ,https://www.scopus.com/inward/record.uri?eid=2-s2.0-85065994051&doi=10.22452%2fmjlis.vol24no1.2&partnerID=40&md5=65903063ca7d2d88dc56850599989fb3,Hyperauthorship: A comparative study of genetics and high-energy physics research,journalArticle,2019,"Changa, Yu-Wei; Huang, Mu-Hsuan; Chiu, Min-Jy",,,,2,2,2,1,,Malaysian Journal of Library and Information Science,,13946234,10.22452/mjlis.vol24no1.2,,2019,2024-06-07 14:43:56,2024-06-07 14:43:56,,23 – 44,,1,24,,,,,,,,,,,,,,,,,Publisher: Faculty of Computer Science and Information Technology,,,,,,,,,,,,,,,,,,,,,,,,,,,,,,,,,,,,,,,,,,,,,,,,,,,
YA249P64,https://www.scopus.com/inward/record.uri?eid=2-s2.0-0035337211&doi=10.1002%2fasi.1097&partnerID=40&md5=4b9781681ad932d7764fe8ee00d8f8fb,Hyperauthorship: A postmodern perversion or evidence of a structural shift in scholarly communication practices?,journalArticle,2001,"Cronin, Blaise",,2,2,,,2,1,,Journal of the American Society for Information Science and Technology,,15322882,10.1002/asi.1097,,2001,2024-06-07 14:43:56,2024-06-07 14:43:56,,558 – 569,,7,52,,,,,,,,,,,,,,,,,,,,,,,,,,,,,,,,,,,,,,,,,,,,,,,,,,,,,,,,,,,,,,,,,,,,
FTUBRLBW,https://www.scopus.com/inward/record.uri?eid=2-s2.0-84995555535&doi=10.3346%2fjkms.2016.31.12.1874&partnerID=40&md5=c8fddc3f95955c7816c8c9cf3692f955,The pressure to publish more and the scope of predatory publishing activities,journalArticle,2016,"Gasparyan, Armen Yuri; Nurmashev, Bekaidar; Voronov, Alexander A.; Gerasimov, Alexey N.; Koroleva, Anna M.; Kitas, George D.",,2,,,2,2,1,,Journal of Korean Medical Science,,10118934,10.3346/jkms.2016.31.12.1874,,2016,2024-06-07 14:43:58,2024-06-07 14:43:58,,1874 – 1878,,12,31,,,,,,,,,,,,,,,,,Publisher: Korean Academy of Medical Science,,,,,,,,,,,,,,,,,,,,,,,,,,,,,,,,,,,,,,,,,,,,,,,,,,,
K8U7MHCD,https://www.scopus.com/inward/record.uri?eid=2-s2.0-85017241211&doi=10.1007%2fs11948-017-9913-3&partnerID=40&md5=04a06b2c84588af066b78204335330a5,Perceptions of Chinese Biomedical Researchers Towards Academic Misconduct: A Comparison Between 2015 and 2010,journalArticle,2018,"Liao, Qing-Jiao; Zhang, Yuan-Yuan; Fan, Yu-Chen; Zheng, Ming-Hua; Bai, Yu; Eslick, Guy D.; He, Xing-Xiang; Zhang, Shi-Bing; Xia, Harry Hua-Xiang; He, Hua",2,,,2,,2,1,,Science and Engineering Ethics,,13533452,10.1007/s11948-017-9913-3,,2018,2024-06-07 14:44:02,2024-06-07 14:44:02,,629 – 645,,2,24,,,,,,,,,,,,,,,,,Publisher: Springer Netherlands,,,,,,,,,,,,,,,,,,,,,,,,,,,,,,,,,,,,,,,,,,,,,,,,,,,
VNCNITFC,https://www.scopus.com/inward/record.uri?eid=2-s2.0-85013389537&partnerID=40&md5=19f979849a40b20ab734bfd0a11b5773,Science in the trap of fraud and corruption,journalArticle,2017,"Luby, Stefan; Lubyova, Martina; Roth, Ladislav E.",,2,,2,1,2,1,"Disagreement between the first two judger, solved by a third reviewer.",Communications - Scientific Letters of the University of Žilina,,13354205,,,2017,2024-06-07 14:44:03,2024-06-07 14:44:03,,117 – 120,,1,19,,,,,,,,,,,,,,,,,,,,,,,,,,,,,,,,,,,,,,,,,,,,,,,,,,,,,,,,,,,,,,,,,,,,
HWX9JXJH,https://www.scopus.com/inward/record.uri?eid=2-s2.0-85076909399&partnerID=40&md5=1a6a9a9a3694d9d1b2f71f35ed676202,Detection of inappropriate types of authorship using bibliometric approaches,conferencePaper,2019,"Mazov, Nikolay A.; Gureev, Vadim N.",2,,,,2,2,0,,"17th International Conference on Scientometrics and Informetrics, ISSI 2019 - Proceedings",978-88-338-1118-5,,,,2019,2024-06-07 14:44:03,2024-06-07 14:44:03,,885 – 895,,,1,,,,,,,,International Society for Scientometrics and Informetrics,,,,,,,,,,,,,,,"G, Catalano; C, Daraio; M, Gregori; H.F, Moed; G, Ruocco",,,,,,,,,,,,,,,,,,,,,,,,,,,,,,,,,,,,,,,,,,,,,
