
8HXA7QNA,https://www.scopus.com/inward/record.uri?eid=2-s2.0-84927515052&doi=10.1016%2fj.tourman.2015.03.008&partnerID=40&md5=5d45bae6baa943c412a556cd51a7a9cb,Publishing in tourism and hospitality journals: Is the past a prelude to the future?,journalArticle,2015,"McKercher, Bob; Tung, Vincent",,,2,2,1,2,1,"Disagreement between the first two judger, solved by a third reviewer.",Tourism Management,,2615177,10.1016/j.tourman.2015.03.008,,2015,2024-06-07 14:44:03,2024-06-07 14:44:03,,306 – 315,,,50,,,,,,,,,,,,,,,,,Publisher: Elsevier Ltd,,,,,,,,,,,,,,,,,,,,,,,,,,,,,,,,,,,,,,,,,,,,,,,,,,,
M7Z4HP87,https://www.scopus.com/inward/record.uri?eid=2-s2.0-85183054391&doi=10.52379%2fmcs.v8i1.386&partnerID=40&md5=a7b0d27355c0dfe7b696d99cc8b3fef1,The ethical issue of honorary authorship and its ramifications in the current scientific environment; [La cuestión ética de la autoría honoraria y sus ramificaciones en el entorno científico actual],journalArticle,2024,"Torales, Julio; O’higgins, Marcelo",,2,,2,,2,1,,Medicina Clinica y Social,,25212281,10.52379/mcs.v8i1.386,,2024,2024-06-07 14:44:08,2024-06-07 14:44:08,,2 – 4,,1,8,,,,,,,,,,,,,,,,,"Publisher: Faculty of Medical Sciences, Santa Rosa del Aguaray Branch, National University of Asuncion",,,,,,,,,,,,,,,,,,,,,,,,,,,,,,,,,,,,,,,,,,,,,,,,,,,
HULR9DUE,https://www.scopus.com/inward/record.uri?eid=2-s2.0-85152080306&doi=10.3138%2fjsp-2022-0035&partnerID=40&md5=4189f503045aa44ee0cc4ade7ec841fc,Quid Pro Quo Authorship characteristics and implications,journalArticle,2023,"Whetstone, Devon; Ridenour, Laura; Moulaison-Sand, Heather",2,,,2,,2,1,,Journal of Scholarly Publishing,,11989742,10.3138/jsp-2022-0035,,2023,2024-06-07 14:44:09,2024-06-07 14:44:09,,15 – 29,,1,54,,,,,,,,,,,,,,,,,Publisher: University of Toronto Press,,,,,,,,,,,,,,,,,,,,,,,,,,,,,,,,,,,,,,,,,,,,,,,,,,,
6KZSU6UI,https://www.scopus.com/inward/record.uri?eid=2-s2.0-85173758765&doi=10.1007%2fs00210-023-02741-w&partnerID=40&md5=4c4d1e197cd92118204804fe5cba7b32,Fake paper identification in the pool of withdrawn and rejected manuscripts submitted to Naunyn–Schmiedeberg’s Archives of Pharmacology,journalArticle,2024,"Wittau, Jonathan; Celik, Serkan; Kacprowski, Tim; Deserno, Thomas M.; Seifert, Roland",,,2,2,,2,1,,Naunyn-Schmiedeberg's Archives of Pharmacology,,281298,10.1007/s00210-023-02741-w,,2024,2024-06-07 14:44:10,2024-06-07 14:44:10,,2171 – 2181,,4,397,,,,,,,,,,,,,,,,,Publisher: Springer Science and Business Media Deutschland GmbH,,,,,,,,,,,,,,,,,,,,,,,,,,,,,,,,,,,,,,,,,,,,,,,,,,,
,,Introduction: Metrics and the new ecologies of academic misconduct,,,,2,2,2,,,2,1,,,,,,,,,,,,,,,,,,,,,,,,,,,,,,,,,,,,,,,,,,,,,,,,,,,,,,,,,,,,,,,,,,,,,,,,,,,,,,,,,,
,,The “Dark Side’’ of Academics? Emerging issues in the gaming and manipulation of metrics in higher education,,,,2,2,,2,,2,1,,,,,,,,,,,,,,,,,,,,,,,,,,,,,,,,,,,,,,,,,,,,,,,,,,,,,,,,,,,,,,,,,,,,,,,,,,,,,,,,,,
,,Academe’s Unspoken Ethical Dilemma: Author Inflation in Higher Education,,,,,2,2,2,,2,1,,,,,,,,,,,,,,,,,,,,,,,,,,,,,,,,,,,,,,,,,,,,,,,,,,,,,,,,,,,,,,,,,,,,,,,,,,,,,,,,,,
,,Detecting anomalous citation groups in journal networks,,,,,2,,2,,2,1,,,,,,,,,,,,,,,,,,,,,,,,,,,,,,,,,,,,,,,,,,,,,,,,,,,,,,,,,,,,,,,,,,,,,,,,,,,,,,,,,,
,,Publish or impoverish: An investigation of the monetary reward system of science in China,,,,,,2,2,,2,1,,,,,,,,,,,,,,,,,,,,,,,,,,,,,,,,,,,,,,,,,,,,,,,,,,,,,,,,,,,,,,,,,,,,,,,,,,,,,,,,,,
,,China's Publication Bazaar,,,,-1,2,2,2,,2,1,,,,,,,,,,,,,,,,,,,,,,,,,,,,,,,,,,,,,,,,,,,,,,,,,,,,,,,,,,,,,,,,,,,,,,,,,,,,,,,,,,